{
  "schema_version": 1,
  "name": "resolution-normalized-formal",
  "description": "Formal paired resolution matrix with marker geometry normalized around the 540p cell 6 reference and ten seconds per measured run.",
  "base_scenario": "../scenarios/h264-540p60-2500k.json",
  "seed": 20260723,
  "repetitions": 5,
  "warmup_runs": 1,
  "variants": [
    {
      "name": "360p-cell4",
      "description": "640x360 with proportional x16/y16/cell4/padding8 geometry.",
      "video": { "width": 640, "height": 360, "frames": 600 },
      "marker": { "x": 16, "y": 16, "cell": 4, "padding": 8 }
    },
    {
      "name": "540p-cell6",
      "description": "960x540 anchor with x24/y24/cell6/padding12 geometry.",
      "video": { "width": 960, "height": 540, "frames": 600 },
      "marker": { "x": 24, "y": 24, "cell": 6, "padding": 12 }
    },
    {
      "name": "720p-cell8",
      "description": "1280x720 with proportional x32/y32/cell8/padding16 geometry.",
      "video": { "width": 1280, "height": 720, "frames": 600 },
      "marker": { "x": 32, "y": 32, "cell": 8, "padding": 16 }
    },
    {
      "name": "1080p-cell12",
      "description": "1920x1080 with proportional x48/y48/cell12/padding24 geometry.",
      "video": { "width": 1920, "height": 1080, "frames": 600 },
      "marker": { "x": 48, "y": 48, "cell": 12, "padding": 24 }
    }
  ]
}
